id_video,titulo,dt_publicacao,id_canal,canal,dt_trending,cont_views,likes,dislikes,cont_comentarios,descricao,categoria
uCsK-ENkiyA,A PRIMEIRA CASA DO CACHORRINHO STEFAN ! - Vida de Maloucos #5,2022-05-06 21:30:04+00:00,UChXTQw_Ma_gYkNsp_a1iYTA,Vida de Maloucos,2022-05-14 00:00:00+00:00,415805,12572,0,189,A PRIMEIRA CASA DO CACHORRINHO STEFAN ! - Fran Japa,People & Blogs
9rYZC2cgqu0,"“Ninguém vai escolher função. Eu sou o Fazendeiro”, diz Rico ao delegar as tarefas | A Fazenda 13",2021-10-07 10:45:57+00:00,UCw4YGFtvDgOL09KrFpqj6kg,A Fazenda,2021-10-08 00:00:00+00:00,870181,48678,1079,13893,"Rico Melquiades já deu início ao seu mandato como Fazendeiro. O influenciador decidiu dar um recado para os peões antes de delegar as tarefas. “Ninguém vai escolher função. Eu sou o Fazendeiro”, disse o participante. Assine o https://www.playplus.com/ e tenha acesso à transmissão 24 horas em nove sinais exclusivos de A Fazenda 13.Inscreva-se no canal A Fazenda: http://r7.com/8IZb Site oficial: https://afazenda.r7.com/a-fazenda-13Assista às íntegras no PlayPlus: https://www.playplus.comTikTok: https://vm.tiktok.com/ZS5cTvgC/Facebook: https://www.facebook.com/AFazendaRecordInstagram: https://www.instagram.com/afazendarecordTwitter: https://twitter.com/afazendarecord#AFazenda13",Entertainment
k-amupfoQBE,Apex Legends | Stories from the Outlands – “Promise”,2020-10-26 15:00:10+00:00,UC0ZV6M2THA81QT9hrVWJG3A,Apex Legends,2020-11-01 00:00:00+00:00,3323775,174916,2303,18638,"Nearly a century ago, Dr. Mary Somers was hired to solve a cataclysmic energy crisis. Her search for answers would take her to the edge of the universe. Before Mary left Olympus, she promised her son she’d return. But was it a promise she’d be able to keep?Apex Legends™ is a free-to-play battle royale game where legendary characters battle for glory, fame, and fortune on the fringes of the Frontier. Play for free now on Xbox One, PS4, and Origin for PC. And play on Steam when Season 7 launches on November 4 !  Learn more about Apex Legends Season 7 – Ascension: http://x.ea.com/65921 Check out our YouTube channel: http://x.ea.com/56710.Follow us on Twitter: https://twitter.com/playapex.Follow us on Instagram: https://www.instagram.com/playapex/.#MeetHorizon #ApexSeason7 #ApexSeason7 #ApexLegends",Gaming
2tMYGARA80Y,O PRIMEIRO GOL COMO PROFISSIONAL EM TREINO! - ( A GRANDE CHANCE ) ep. 2,2021-01-08 21:00:00+00:00,UCMPPsRQg12IYk2V7vOfx-9A,Vosso Canal,2021-01-16 00:00:00+00:00,817027,85718,1259,1945,"SEJA SÓCIO TORCEDOR - https://sociobentao.com.br/INSTA SÃO BENTO - https://www.instagram.com/ecsaobento1913/TWITTER SÃO BENTO - https://twitter.com/ecsaobento1913Galera se liga!! Estreia dia 5 de Janeiro, terça-feira!! Às 18 horas!! (6 da tarde!)Galera o segundo dia de treino chegou e o Juninho já conseguiu fazer gol, se liga no golaço!!FACEBOOK VOSSO CANAL LIVE - https://bit.ly/3cq7BBT🔴 CANAL NOVO 🔴: https://www.youtube.com/channel/UC_spRk_FrMjMRddBt6FHgSg🔴 CANAL NOVO 🔴: https://www.youtube.com/channel/UCkGb7ja2s8cwLVmyht-Mm5w🔴 CANAL NOVO 🔴: https://www.youtube.com/channel/UCh4CpTrKqQH7QFdAQsb3XfQExperimente 1 mês grátis do banco de trilhas Epidemic Sound:  http://share.epidemicsound.com/vossocINSCREVA-SE: https://www.youtube.com/channel/UCMPPsRQg12IYk2V7vOfx-9A/videosemail para parcerias: vossocanal@adragencia.com.brSE QUISEREM MAIS ESSE TIPO DE VÍDEO ESTOUREM DE LIKE!!CURTA NOSSA NOVA PAGINA NO FACEBOOK: https://www.facebook.com/VossoCanal-1322530574487146/?ref=aymt_homepage_panelcanal do rezende: https://www.youtube.com/user/rezendeevilCOMPUTADOR DO VOSSO CANAL:https://www.youtube.com/watch?v=aT5GBmdPnCsSite: https://www.chipart.com.br instagram JUNINHO - https://www.instagram.com/juninhomanellaROSSINI - https://www.instagram.com/joaorossini7/twitter @vossocanal",Sports
oZAgfOAjMqY,Cesar Mc part. Djonga N*GUIN (Videoclipe Oficial),2021-09-08 20:30:10+00:00,UCqrFwa5vueOTzGZ7NSlnvlQ,PineappleStormTV,2021-09-15 00:00:00+00:00,688150,87275,291,2073,"Escute na sua plataforma preferida: https://ONErpm.link/DaiACesarOQueEDeCesarUma Realização Pineapple Storm Records.'Neguin'' é a terceira faixa do album de estreia de Cesar Mc, Dai a Cesar o que é de Cesar'.Música - NeguinLetra/Voz - Cesar Mc e DjongaProdução Musical - Tibery e Felipe ArtioliMixagem - Felipe ArtioliMasterização - Brendam DuffeyProdução Executiva - Paulo AlvarezRealização: GB LabDireção: Guilherme BrehmCodireção: Ana ValenteAssistência de direção: Jamile SelvaDireção de produção e produção executiva: Mariana Campitelli Assistência de produção: Luiza MontePlatô: Giulia PortellaDireção de fotografia: Gabe Gomez Assistente de câmera: Clara TinocoGaffer: Gabriel EscavaEletricistas: Mazinho Freitas e Elvis VieiraFotografia Still: Sofia Selvatice TourinhoMaking of: Mateus Ribeiro Amorim e Giliana Ribeiro MelettiDireção de arte: Tita IllidioConcepção do figurino: Sofia Selvatice TourinhoProdução de arte: Nath SantosMake: Robs MenezesEdição: Guilherme Brehm Colorista: Braion MarçalElenco de apoio:Ana GregórioJhean LimaJuliano ViannaJohnny AyresLettícia Eugenio Transporte: Gabriel Cartajena, JR Turismo e KekéCoordenador de segurança: Magno LopesSegurança: Benjamin Moraes e Rômulo Neves",Music
YdHVOT9kVYI,FIM DE THE KILLER IN PURPLE 2? CRIANÇAS VIRAM PIZZA NA FÁBRICA!,2021-12-05 15:00:30+00:00,UCs2AZhOnCTX0P4NtyNpuetQ,Febatista,2021-12-10 00:00:00+00:00,303144,12531,251,761,"Hoje vamos jogar The Killer in Purple 2! Conheça a nova atualização que trouxe mais de 20 animatronics, novos mistérios, segredos e novos locais!Jogo: https://gamejolt.com/games/KillerInPurple/507258Vire Membro ( Clube com Emotes Exclusivos do Canal)https://www.youtube.com/channel/UCs2AZhOnCTX0P4NtyNpuetQ/join⭐Faça parte da nossa comunidade!https://discord.com/febatista⭐ Redes Sociais do Canal:🐦Twitter: https://twitter.com/febatista💻 Facebook: https://www.facebook.com/FebatistaBR/📷Instagram: http://instagram.com/febatista📧Contato Comercial: contatofebatista@gmail.com",Gaming
1EYWhkcZzOs,"SIM, NÓS TERMINAMOS!! (O FIM)",2021-03-16 17:31:56+00:00,UChafmVG1vYyf8eW9IRgAeWA,Igor Wender,2021-03-25 00:00:00+00:00,993581,100079,14906,9563,Se você gostou e quer mais videos assim deixa um gostei ai ❤► MEU INSTAGRAM: @ofc.wendeer (http://instagram.com/ofc.wendeer)► Canal da tiffany: https://www.youtube.com/channel/UCCUTROqZZJY8yVzO_6K9bPQTRABALHOS E PARCERIAS VIA WPP 11 91124-9684,Entertainment
eRvObKZsMus,As impressionantes imagens da erupção de vulcão em Tonga,2022-01-17 14:35:21+00:00,UCthbIFAxbXTTQEC7EcQvP1Q,BBC News Brasil,2022-01-24 00:00:00+00:00,481139,14901,0,1022,"O vulcão Hunga Tonga-Hunga Haʻapai, que fica submerso no oceano Pacífico em Tonga, entrou em erupção no último dia 15 de janeiro, desencadeando um tsunami.Até o momento em que publicamos este vídeo, não há relatos de mortes, mas tanto as cinzas como as inundações deixaram boa parte do país incomunicável e sem luz.O vulcão fica a apenas cerca de 65 km da capital, Nuku'alofa.A erupção foi tão forte que pôde ser ouvida nos EUA, a milhares de quilômetros dali. No Peru, duas pessoas se afogaram por causa das ondas altas geradas pela atividade vulcânica no Pacífico.Confira, neste vídeo, imagens da erupção – de perto e do alto.Curtiu? Inscreva-se no canal da BBC News Brasil! E se quiser ler mais notícias, clique aqui: https://www.bbcbrasil.com#BBCNewsBrasil #Erupção #Tonga",News & Politics
tkTTqI3DXUM,Google Wifi: O Wi-fi que funciona.,2021-10-14 14:30:17+00:00,UCf2qcg2_6N5ltXnqu1-4Fmg,Google Brasil,2021-10-25 00:00:00+00:00,2757747,27639,3623,0,"O Wi-fi que funciona.Os pontos Google Wifi cobrem a casa inteira com uma conexão rápida, confiável e sem armazenamento em buffer em todos os ambientes.Seu sistema inteligente funciona nos bastidores para garantir a rapidez do Wi-Fi o tempo todo. Durante uma videochamada, você pode mudar de ambiente sem interrupção do sinal.Como a atualização é automática, você sempre terá recursos novos e sua rede estará sempre protegida.Use o app Google Home para criar e começar a usar sua rede em minutos, mesmo que você não entenda de tecnologia.Com permissões específicas, o pai e a mãe podem definir programações para gerenciar o tempo de uso, restringir certos tipos de conteúdo adulto e pausar o Wi-Fi em alguns dispositivos quando quiserem.Com o Google Wifi, é fácil priorizar dispositivos, conferir a velocidade da rede, configurar uma rede para visitantes e muito mais. Você faz tudo isso no app Google Home.Onde encontrar:Magazine Luiza -  https://www.magazineluiza.com.br/busca/google%20wifi/Fast Shop - https://www.fastshop.com.br/web/s/google%20wifiAmericanas - https://www.americanas.com.br/busca/google-wifiShoptime - https://www.shoptime.com.br/busca/google-wifiCasas Bahia - https://www.casasbahia.com.br/google-wifi/bExtra - https://www.extra.com.br/google-wifi/bPonto Frio - https://www.pontofrio.com.br/google-wifi/bSubmarino - https://www.submarino.com.br/busca/google-wifi",Science & Technology
6OgGB4Ueco8,Consigo Roubar Pedaços dos Mobs!,2022-04-20 14:00:01+00:00,UCEfGV5hx2VrXl4jOUnG0MRQ,Geleia,2022-04-26 00:00:00+00:00,1274145,51833,0,1008,🐲 Faça Download de Dragon City agora pelo link: https://dragoncity.onelink.me/DDHl/brapril22🐦 Twitter: https://bit.ly/DCTwitterIMCM📷 Instagram: https://bit.ly/DCInstagramIMCM💬 Discord: https://bit.ly/DCDiscordIMCM📞 Contato Profissional: comercial@agenciacurta.com,Gaming
cii6ruuycQA,Olivia Rodrigo - deja vu (Official Video),2021-04-01 16:00:27+00:00,UCxE5jEls-T0QtlTHT8lI1lw,OliviaRodrigoVEVO,2021-04-12 00:00:00+00:00,27245543,1252955,25339,77123,"Listen to ‘deja vu’ out now: https://OliviaRodrigo.lnk.to/dejavu​ Pre-order the debut album *O*R: https://OliviaRodrigo.lnk.to/preorder​Co-starring - Talia Ryder Shop the deja vu collection: https://smarturl.it/oliviarodrigoshopDirector - Allie AvitalProduction Co. - SMUGGLER x north of now Executive Producer - Elizabeth DoonanCreative Producer - Daniel YaroProducer - Matisse GaillardAssistant Director - Lynna BaculoCinematography - Logan TriplettSteadicam - Renard Cheren Gaffer - Cole PisanoGrip - Colin Stoye Art Director - Jake TremblayProduction Designer - Natalia Brito Editor - Lindsey NadolskiColorist - Kaitlyn BattistelliVFX - B.Art VFXFollow Olivia Rodrigo:Instagram: https://instagram.com/oliviarodrigo​​​Twitter: https://twitter.com/Olivia_Rodrigo​​​Facebook: https://www.facebook.com/OliviaRodrigoOfficialYouTube: https://youtube.com/oliviarodrigomusic​​​TikTok: https://tiktok.com/@livbedumb​​​Store: https://smarturl.it/oliviarodrigoshopMusic video by Olivia Rodrigo performing deja vu. © 2021 Olivia Rodrigo, under exclusive license to Geffen Recordshttp://vevo.ly/6wgmhZ",Music
NDX7FbESEEQ,SÃO PAULO 0 x 1 FORTALEZA| MELHORES MOMENTOS | 12ª RODADA BRASILEIRÃO 2021 | ge.globo,2021-07-17 22:16:37+00:00,UCgCKagVhzGnZcuP9bSMgMCg,ge,2021-07-19 00:00:00+00:00,778528,23979,612,2311,"Fortaleza bate o São Paulo no Morumbi. Leão engata a terceira vitória seguida e complica o Tricolor paulista em jogo marcado por crise convulsiva de integrante da comissão técnica do time paulista.🌟 Confira todos os Melhores Momentos com mais replays em ge.globo: https://ge.globo.com/sp/futebol/brasileirao-serie-a/jogo/17-07-2021/sao-paulo-fortaleza.ghtml#SaoPaulo #Fortaleza #Brasileirao2021______________________________________✅ INSCREVA-SE NO CANAL GE:  https://cutt.ly/xfHlwBk👍 Curtiu o vídeo? Deixe seu like e dê seu pitaco 😎⚽ 🌟 Playlists pra você maratonar 🌟 ► Bola Quadrada:  https://cutt.ly/IfHk7ra ► BMFC: https://cutt.ly/gfHk5bH►Humor no GE: https://cutt.ly/HfHk6SY►Jogos Históricos: https://cutt.ly/BkxoZJX► Listas e TOPs: https://cutt.ly/hkxo51U► Originais GE: https://cutt.ly/vkxpunL► Melhores Momentos do Brasileirão:  https://cutt.ly/NfHk9TS► Melhores Copa do Brasil: https://cutt.ly/LfHk3Di► Gols Série B: https://cutt.ly/LfHk84c✅ Inscreva-se, também, no canal do CARTOLA FC e fique por dentro das melhores dicas do maior fantasy game do Brasil - https://cutt.ly/ffV1Xri______________________________________  No canal ge você encontra os melhores conteúdos do FUTEBOL BRASILEIRO! 🤙😎",Sports
z6I-uZnu-3I,Congonhas: Barragem de rejeitos tira o sono de moradores- Jornal Minas,2022-01-13 13:08:19+00:00,UCvmjnRirYcvH60tuOGTAE6A,Jornal Minas,2022-01-20 00:00:00+00:00,170762,1906,0,125,"Em Congonhas, na região central de Minas, moradores também sofrem comas consequências dos últimos temporais. Mas o que a população mais teme é o rompimento da barragem de rejeitos da Companhia CSN.#JornalMinas #RedeMinas #Barragem #Congonhas ------------------------------------------Veja mais do Jornal MinasSite - http://redeminas.tv/jornalminasFacebook - http://facebook.com/jornalminasYouTube - http://youtube.com/jornalminastvVeja mais da Rede MinasSite - http://redeminas.tvFacebook - http://facebook.com/redeminas.tvTwitter - http://twitter.com/redeminasInstagram - http://instagram.com/redeminastvYouTube - http://youtube.com/redeminasO Jornal Minas cobre os fatos que mais se destacam no Estado, com entrevistas ao vivo, opinião de especialistas e reportagens especiais. Temas como direito do cidadão, sustentabilidade, trabalho, economia, futebol mineiro e a agenda cultural, tratados de maneira dinâmica e responsável.",News & Politics
vx8myzXw8cA,Como é VOAR NO CAÇA DA MARINHA DO BRASIL A-4 Skyhawk,2021-10-03 13:15:02+00:00,UC32z4mtyiq02Ge-XWy78ibw,Aero Por Trás da Aviação,2021-10-08 00:00:00+00:00,356313,42056,195,1602,"✈✈ Loja do Aero: https://bit.ly/loja_aero✈ Seja Membro do Canal: http://bit.ly/membroaero✈ Se inscreva: http://bit.ly/inscritoaero✈ Instagram: @programaaero✈ Facebook: https://www.facebook.com/aeroportrasdaaviacao✈ Conheça nosso canal de viagem Sonho e Destino: http://bit.ly/2gOV1la✈ Conheça nosso curso online de aviação: http://aerohelps.com.brQuando falamos da Marinha do Brasil normalmente vamos lembrar de navios e submarinos. Mas a Marinha também opera com helicópteros e aviões. Fomos até a base aeronaval da marinha para ver como é voar no caça Douglas A-4 Skyhawk. Tive minha primeira experiência voando em um caça com motor turbojato no primeiro esquadrão de asa fixa da marinha, o AF-1, também conhecido como Esquadrão Falcão. Nesse vídeo você vai acompanhar como foi esse voo incrível. Conteúdo:00:00 - Introdução01:10 - Assento ejetável03:11 - A Marinha do Brasil05:24 - Preparação para o voo06:24 - O voo do caça A-410:47 - Pouso em porta aviões16:53 - EncerramentoEquipe Aero:Apresentação e Direção: Fernando De BortholeCâmeras: Vinicius Lucas e Guilherme StopaProdução: Luiza MungoProdução Executiva: Gisella Depiné PoffoEdição e finalização: Guilherme Stopa e Fernando De BortholeO canal Aero, Por Trás da Aviação tem o objetivo de desmistificar o universo da aviação, de forma leve e descontraída, para aproximar o público dessa área tão curiosa.Todos os protocolos de segurança sanitária foram seguidos para a gravação desse vídeo, conforme exigido pela Marinha do Brasil. As duas pessoas que aparecem no vídeo foram testadas para COVID e ambas já tomaram as duas doses da vacina.",Entertainment
Q-JBQGe5Zhw,Se Liga Na Educação - Matemática - 26/08/20,2020-08-26 16:26:00+00:00,UCXV8LznurdAhfXk660O27uA,Rede Minas,2020-08-31 00:00:00+00:00,62755,3116,566,359,"Após as aulas, os vídeos estarão disponíveis no canal: https://www.youtube.com/channel/UCTAE3t96gJbgn1K-0yaPV2Q O Programa Se Liga na Educação é uma iniciativa da Secretaria de Estado de Educação, apoiada pela Rede Minas e é parte do Regime de Estudo Não Presencial. Vai exibir aulas com conteúdos dos diferentes componentes curriculares, divididos por grupos de disciplinas e voltadas para cada ano de escolaridade. O objetivo é levar conteúdos escolares aos alunos da rede pública, neste momento em que as atividades presenciais estão suspensas e as escolas fechadas por causa da pandemia do coronavírus.  https://estudeemcasa.educacao.mg.gov.br/se-liga-na-educacaoHorárioVai ao ar de 7h30 a 12h30, de segunda a sexta-feira.As aulas são posteriormente disponibilizadas separadamente no aplicativo Conexão Escola e no canal do YouTube da Secretaria de Estado de Educação (http://youtube.com/estudioeducacaomg).------------------------------------------Inscreva-se: http://bit.ly/redeminasyoutube------------------------------------------App: http://bit.ly/appRedeMinas (Google Play)------------------------------------------Veja mais da Rede MinasSite - http://redeminas.tvFacebook - http://facebook.com/redeminas.tvTwitter - http://twitter.com/redeminasInstagram - http://instagram.com/redeminastvYouTube - http://youtube.com/redeminas",Education
_UWZfHU2Ohk,Ludmilla e Xamã - Gato Siamês,2021-04-16 15:06:11+00:00,UCSCB1IQUmNa8Gn5VfSUAUpg,Ludmilla,2021-04-25 00:00:00+00:00,3465778,162130,3181,13000,"#Ludmilla #Xamã #GatoSiamesDiretor: João MonteiroMe siga nas redes:http://www.instagram.com/ludmillahttp://www.twitter.com/ludmillahttp://www.facebook.com/oficialludmillahttp://www.tiktok.com/@ludmillaSiga Xamã nas redes:http://www.instagram.com/euxamahttp://www.twitter.com/xamaoficialhttp://www.facebook.com/xamamc http://www.tiktok.com/@euxama44Letra:Ludmilla e Xamã - Gato SiamêsComposição: Ludmilla e XamãVou te avisar Você corre perigo Deitado na minha cama Sexo comigo é incrível Pulou pro sofá Com cara de quem quer continuar Acende a blunt Assume o volante Vai me chama pra fumar Tá tudo bem Te deixo me fazer de refém Mas jogo limpo contigo Sabe que só é mais um no meu harém Não quero cometer Esse crime de novo Te fazer sofrer, te fazer chorar E você reclamando com o povoEu já conheço esse filme E você também Mas eu sou o problema Que te faz sentir tão bem Então vem Como um gato siamês Pagando o ingresso mais caro Só pra chorar outra vez A gente se usa por hoje Eu tô de volta daqui a um mêsJá vou te avisar Se pá eu te odeio, te amo, te beijo e te vejo blefando pra nós Valeu por tentar Mas hoje tem papo de 30 sentando Mas, eu ouço sua voz me chamando mais Eu ouço sua voz Louca, louca Tô passando mal Faz um boca a boca Porra Tu é fenomenal Nossa vibe é outra Só não vem de garfo que hoje a janta é sopa Opa, ela quer me mal Eu sou todo errado Minhas ideias é pouca Louca, ela quer meu Toda apaixonada Que mania escrota To love me Vivo entre hotéis e lofts Lágrimas, troféus nos móveis Seus olhos, todos os santos, todas as estrelas, quase todos os OVNIs Eu não te amo, isso é lógico Eu tô blefando, isso é óbvio Malak beat neuróticoVou te avisar Você corre perigo Deitado na minha cama Sexo comigo é incrívelTu brinca demais Desculpa, mas hoje eu não tenho um bom plano Só um vinho maldito, um piano pra nósTá tudo bem Te deixo me fazer de refém Mas jogo limpo contigo Sabe que é só mais um no meu harémQuanto tempo faz Não sei se são meses ou são anos que eu Cai no baile do cigano Você me amou por engano",Music
0DAgrOCY13o,Problema resolvido! #shorts,2021-10-26 22:19:35+00:00,UCACXj9qXlodfBqVO4h0WAfQ,lkda9ofc,2021-11-01 00:00:00+00:00,1346794,106153,3349,314,,Comedy
4p9bs8Loxuw,Neymar: O Caos Perfeito | Teaser Oficial | Netflix,2021-12-14 13:00:00+00:00,UCc1l5mTmAv2GC_PXrBpqyKQ,Netflix Brasil,2021-12-20 00:00:00+00:00,301960,22516,0,842,"Um dos atletas mais famosos e bem pagos da história como você nunca viu antes. Neymar é um herói em campo e uma figura polêmica fora. Esta série documental em três partes, dirigida por David Charles Rodrigues, mostra o lado pessoal do astro do futebol, acompanha sua ascensão à fama no Santos, seus dias de glória no FC Barcelona e a montanha-russa com a Seleção Brasileira e o Paris Saint Germain. O documentário também revela a máquina de marketing por trás do jogador, comandada pelo seu pai. Repleta de estrelas, a série traz ainda entrevistas com Beckham, Messi, Mbappé e muitas outras lendas, que avaliam o lugar de Neymar na história do esporte.Inscreva-se: https://bit.ly/31ynwtwSobre a Netflix:A Netflix é o principal serviço de entretenimento por streaming do mundo. São 214 milhões de assinaturas pagas em mais de 190 países com acesso a séries, documentários e filmes de diversos gêneros e idiomas. Quem assina a Netflix pode assistir a quantos filmes e séries quiser, quando e onde quiser, em praticamente qualquer tela com conexão à internet. Assinantes podem assistir, pausar e voltar a assistir a um título sem comerciais e sem compromisso. Neymar: O Caos Perfeito | Teaser Oficial | Netflixhttps://youtube.com/NetflixBrasilAclamado e criticado no mundo todo, Neymar compartilha os altos e baixos de sua vida pessoal e da brilhante carreira no futebol.",Entertainment
SzuKfQfM1vc,IMERSÃO VISIONÁRIA #1 Como PARAR DE PERDER DINHEIRO e APROVEITAR AS OPORTUNIDADES HOJE,2021-07-08 00:25:00+00:00,UC8mDF5mWNGE-Kpfcvnn0bUg,Me poupe!,2021-07-11 00:00:00+00:00,410476,48015,527,1431,"Pra ver as próximas aulas da IMERSÃO VISIONÁRIA com a Nath pra aprender a investir como gente grande! Inscreva-se de graça: https://bit.ly/3xpkV43Último ano da Jornada com a Nath: Lista de espera para o curso completo aqui 👉https://bit.ly/3hDpCRgEntre no grupo do Telegram Exclusivo da Nath:  https://t.me/jornadadadesfudenciaAI QUE FESTA DAS OPORTUNIDADES!Na primeira aula da IMERSÃO VISIONÁRIA, vou revelar como AS OPORTUNIDADES DE GANHAR MAIS DINHEIRO aparecem na sua vida e vou te ensinar a COMO AGARRÁ-LAS O MAIS RÁPIDO POSSÍVEL!Você já parou pra pensar em quantas vezes uma OPORTUNIDADE DE OURO passou por você e, por não saber como aproveitá-la, você acabou deixando ela ir embora?Depois desta aula eu garanto que você vai começar a ENXERGAR OS INVESTIMENTOS EM RENDA FIXA E RENDA VARIÁVEL por uma nova ótica: uma ótica que vai te permitir GANHAR MUITO MAIS DINHEIRO de formas que você nem imagina que são possíveis!",People & Blogs
Auzs95InJzo,VIKINGS Final Season – Official Trailer | Amazon Prime Video,2020-12-02 14:00:02+00:00,UCQJWtTnAHhEG5w4uN0udnUQ,Amazon Prime Video,2020-12-10 00:00:00+00:00,2763190,79051,945,6345,"Ragnarök: Twilight of the Gods. No one escapes their fate.» Watch #Vikings now exclusively with your Prime Membership: https://bit.ly/VikingsPrimeVideo» SUBSCRIBE: http://www.youtube.com/channel/UCwSIJ...About Vikings: Vikings follows the adventures of Ragnar Lothbrok the greatest hero of his age. The series tells the sagas of Ragnar's band of Viking brothers and his family, as he rises to become King of the Viking tribes. As well as being a fearless warrior, Ragnar embodies the Norse traditions of devotion to the gods, legend has it that he was a direct descendant of Odin, the god of war and warriors.Get More Prime Video: Watch More: http://bit.ly/WatchPrimeVideoUKNowFacebook: http://bit.ly/PrimeVideoUKFacebookTwitter: http://bit.ly/PrimeVideoUKTwitterInstagram: http://bit.ly/PrimeVideoUKInstagramAbout Prime Video:Want to watch it now? We've got it. This week's newest movies, last night's TV shows, classic favorites, and more are available to stream instantly, plus all your videos are stored in Your Video Library. Over 150,000 movies and TV episodes, including thousands for Amazon Prime members at no additional cost.VIKINGS Final Season – Official Trailer | Amazon Prime Videohttps://youtu.be/Auzs95InJzoPrime Videohttps://www.youtube.com/c/primevideouk",Entertainment
