id_video,titulo,dt_publicacao,id_canal,canal,dt_trending,cont_views,likes,dislikes,cont_comentarios,descricao,categoria
c08-71b8IT8,ANY GABRIELLY NOS BASTIDORES DO ENSAIO DE NATAL | #NatalDosSunshines,2020-12-22 15:00:12+00:00,UCULQ_8Rnove-7in8ldIpqVQ,Central de Fãs Any Gabrielly,2020-12-31 00:00:00+00:00,128668,23256,143,1384,O Natal dos Sunshines está cheio de surpresas e uma delas foi o ensaio fotográfico natalino com uma Any Gabrielly... LOIRA! Confira os bastidores e não se esqueça de inscrever-se no canal da Any: https://www.youtube.com/channel/UC7m3MaNwO8dX54_oqcEaGnA_Hip Hop Christmas de Twin Musicom é licenciada de acordo com a licença Atribuição 4.0 da Creative Commons. https://creativecommons.org/licenses/by/4.0/Artista: http://www.twinmusicom.org/,Entertainment
k3M2Baxnx2g,ESTOU GRÁVIDA 🤰 | DESCOBRINDO A SEGUNDA GRAVIDEZ antes do ATRASO | Nadja Meyre,2021-05-12 15:02:10+00:00,UC0VbPVB-BQeAjyaDXVLmTiQ,Nadja Meyre,2021-05-20 00:00:00+00:00,255386,34441,533,3754,▪ SE INSCREVA e ativa as notificações para não perder nada! ♥ ▪Instagram: (@nadja_meyre)https://www.instagram.com/p/CIODwSklpF1/?igshid=1ng5i8pgzzypc▪PARCERIAS / DIVULGAÇÕEShttps://instagram.com/nadjaassessoria?igshid=zx39gdpmpu35▪Obrigada por tudo!❤️,People & Blogs
Kp0Y4imTnEk,7 Hacks Impossíveis de Construção Sem Mods!,2022-05-09 18:45:00+00:00,UCEfGV5hx2VrXl4jOUnG0MRQ,Geleia,2022-05-14 00:00:00+00:00,2680014,101380,0,1258,📷 MEU INSTAGRAM: https://www.instagram.com/geleia👉 Créditos: https://www.youtube.com/c/MysticatLive👨‍👨‍👧 Participante:  @Hurtig  @Lopers   @Ligonz  @Noobzinho @RobinTV 📞 Contato Profissional: comercial@agenciacurta.com,Gaming
aOtP-drbd7A,Metaforando Vs. Mussoumano - Batalha de Youtubers,2020-11-13 23:00:10+00:00,UC607Gii1uo93qDqiGR6-c3w,Mussoumano,2020-11-20 00:00:00+00:00,495137,69777,1010,3784,"Ouça a NOVA MÚSICA: https://youtu.be/kXZU5rf2lBgOuça o álbum Dupla Personalidade completo: https://ps.onerpm.com/duplapersonalidadeAssista as NOVAS BATALHAS: https://www.youtube.com/watch?v=aOtP-drbd7A&list=PLj_r6fchQfwYRhfFSpRJ6MlvateXHksQ2• contato profissional e parcerias: contato@mussoumano.com.br• Siga nas outras redes @mussoumanoMas o que é a Batalha de Youtubers?Ironia, criatividade, humor ácido e muitas gargalhadas é que você pode esperar da “Batalha de Youtubers” o duelo musical mais louco do Youtube.  O rapper e youtuber Mussoumano, desafia famosos, influenciadores e celebridades para uma batalha de rap e o resultado é surpreendente. Atualmente a batalha é uma das séries da internet com maior número de visualizações, alguns dos episódios ultrapassam a marca de 20 milhões de views.  Em 2020, a série ganha nova temporada, muito mais irreverente, com novos artistas e claro, mais irônica do que nunca.#BatalhaDeYoutubers #Metaforando #Mussoumano",Entertainment
R8-i-9u5P4M,QUEM VENCERIA: LEÃO OU CAPIVARA? - CANAL DO CLEPTON,2021-05-12 21:30:01+00:00,UCDaM5npyBufSF9XF7XnDlsA,CLEPTON,2021-05-22 00:00:00+00:00,2826339,357341,4923,1002,"Salve, galera. Hoje eu to aqui com o meu amigo @Juliano Coração que respondeu uma grande dúvida, que eu tenho certeza que você já se perguntou: quem venceria numa briga: um leão ou uma capivara?#Shorts #HumorSalve, pessoal! Eu sou o Erick Clepton, humorista, roteirista, improvisador, tiktoker e pai de gatos e de uma cachorra, namorado da Amanda e irmão do Pierre. Aqui você vai acompanhar curiosidades, entrevistas, piadas e o que mais pudermos inventar!Se siga para não perder nenhuma novidade!",Comedy
xdcueqdz9i8,IMPROVÁVEL - MORTES #24,2022-05-26 22:00:33+00:00,UCZbgt7KIEF_755Xm14JpkCQ,Barbixas,2022-06-03 00:00:00+00:00,223873,31713,0,566,"Nada como ficar bonita para comemorar o aniversário de casamento em uma churrascariaASSISTA AO VIVO:http://www.barbixas.com.br--Convidados:MC: Guilherme ToméJogador: Bella MarcattiMúsico: Andrés GiraldoJogo: MortesRegra: A plateia sugere três formas inusitadas de morte. Os atores devem iniciar uma cena que somente termina quando todos morrerem dessas causas incomuns.Tema: Relógio, Máscara e Baby BeefImprovável é um espetáculo criado, encenado e produzido pela Cia. Barbixas de Humor.www.barbixas.com.brGravado no Teatro Iguatemi CampinasDia 11/12/2021",Comedy
nZu_a8Lp-rc,PIERRE QUER SER UM TUBARÃO??? MEDO DO ESCURO??? ENTREVISTANDO MEU IRMÃO - CANAL DO CLEPTON,2022-02-03 22:30:08+00:00,UCDaM5npyBufSF9XF7XnDlsA,CLEPTON,2022-02-08 00:00:00+00:00,1427374,179711,0,324,"🎃 Aventuras Estranhas: A Noite Do Meteoro 👻👽 Garanta seu livro https://amzn.to/3aSd1qmNo vídeo de hoje eu entrevisto meu irmão Pierre e ele me conta coisas muito importantes como: de que jeito escovaria os dentes se fosse um tubarão e se ele tem medo do escuro. Conta pra mim nos comentários qual animal marinho você seria ✍️💭#Shorts #HumorSalve, pessoal. Tudo bem vocês?Pra você que está chegando agora, eu sou o Erick Clepton (quase como o cantor), humorista, roteirista, improvisador, namorado da Amanda e irmão do Pierre. Aqui no canal você vai acompanhar curiosidades, entrevistas, piadas, jogos de improvisos e o que mais pudermos inventar! 🚀Participe deixando a sua sugestão de tema e vídeo na aba comunidade, e não esqueça de se inscrever para não perder nenhuma novidade. 🦖Comercial: clepton@flocks.tv🤖Edicão: Guilherme SouzaProdução executiva: Flocks",Comedy
5xZF3Hz_OOE,Finalmente AXOLOTES e CABRAS - Minecraft Em busca da casa automática #315,2021-06-25 21:05:55+00:00,UCiIZY89KwQkxAW-4Le7U7zg,viniccius13,2021-07-06 00:00:00+00:00,2028132,249560,1229,13346,+ Episódios: http://www.youtube.com/playlist?feature=edit_ok&list=PLD40851E0E52E9080Canal do Davi: https://www.youtube.com/user/HDDavigamerTwitter: https://twitter.com/#!/viniccius13Facebook: http://www.facebook.com/13viniccius?ref=hlEmail(contato profissional): vinicciustreze@gmail.comConfiguraçoes do meu Computador:◆ PC:  https://goo.gl/15bTW9◆ Chipart: https://goo.gl/dHKNx4Production Music courtesy of Epidemic Sound: http://www.epidemicsound.comViniccius13,Gaming
fq2qUJCKr-0,Detalhes que te DEIXAM MAIS VELHA | Moda Feminina e Estilo,2021-12-12 22:30:01+00:00,UCTfRisjbGU3vCnZfGaFdlIQ,Luciane Cachinski,2021-12-20 00:00:00+00:00,179319,21404,0,863,"Está aí uma coisa que a gente sempre tenta evitar. Então nesse vídeo vou passar para vocês alguns detalhes muito simples, que podem te trazer uma jovialidade a mais, dando leveza para seus looks e para o seu dia a dia e isso não é questão de querer esconder a idade.Afinal de contas, quem não quer parecer mais jovem, parecer mais nova, não é mesmo?Minha loja online (Corte In Brazil): http://bit.ly/Corte-in-BrazilMe siga também no Instagram: http://bit.ly/Luciane-Cachinski-InstagramSiga o Instagram da Corte in Brazil: http://bit.ly/Instagram-Corte-in-BrazilFacebook: https://www.facebook.com/CorteInBrazilOficial/Meus perfumes:https://macdecants.com.br/https://muskone.com.br/O básico é o que você precisa!Moda feminina em malhaFabricação própriaVideira - SC...Edição e Pós-Produção - John Delmiro: (49) 999950112Instagram @johndelmiro : https://www.instagram.com/johndelmiro/?hl=pt-br",People & Blogs
-UCDXvmgias,Carnage in Le Classique! Neymar amongst FIVE players sent off!,2020-09-13 21:32:49+00:00,UC4i_9WvfPRTuRWEaWyfKuFw,BT Sport,2020-09-20 00:00:00+00:00,9061221,100499,5691,9269,"PSG VS Marseille finishes 8v9 after the referee gives FIVE red cards, including one for Neymar, in the final few minutes! Neymar tells the fourth official there was a racist incident after receiving his marching orders...Hit 'Subscribe' above to ensure you never miss a video from the BT Sport YouTube channel.Visit and subscribe to our 'BT Sport Boxing' YouTube channel ➡️ http://www.youtube.com/c/btsportboxingTwitter: http://twitter.com/btsportFacebook: http://www.facebook.com/btsportInstagram:http://instagram.com/btsportWebsite: http://sport.bt.com",Sports
g75yk7GfdAo,Cardi B Joins Migos For A Turnt Up Performance of ‘Straightenin' & ‘Type Sh*t’ | BET Awards,2021-06-28 00:47:05+00:00,UCcVqCJ_9owb1zM43vqswMNQ,BETNetworks,2021-07-07 00:00:00+00:00,4422055,113585,5003,7972,"Cardi B surprises the crowd and joins Migos for a turnt up performance of “Straightenin’” and “Type Sh*t” at the 2021 BET Awards. #CulturesBiggestNight #BETAwardsSUBSCRIBE to #BET! ►► http://bit.ly/1U0v9xGStream Black Culture with BET+. Kick back and enjoy movies, TV series, exclusive originals and the best of Tyler Perry. Sign up for BET+ ►► http://bit.ly/betplus Connect with BET Web: http://www.BET.comFacebook: http://www.facebook.com/BETTwitter: http://www.twitter.com/BETInstagram: http://www.instagram.com/BETBET+: https://www.bet.plus https://www.instagram.com/betplus/https://twitter.com/betplushttps://www.facebook.com/yourbetplus/Google+: http://www.bet.us/gplusBET",Entertainment
pjBGpD7mcTo,😋🍫😁 QUANDO EU TÔ COMENDO CHOCOLATE 😁🤔🤣,2021-11-21 13:23:00+00:00,UC5DZBjR6W561Txc_vrRWTow,Familia Parafuso Solto,2021-11-27 00:00:00+00:00,5268990,400993,27945,1268,#shorts,Comedy
7ExX6w3h9FA,TEM ALGUÉM NA MINHA CASA,2022-02-06 00:22:45+00:00,UC8GsQQXt6QvnkFVH-XL6kKg,Robson Abreu,2022-02-11 00:00:00+00:00,1870883,191346,0,6700,,People & Blogs
Dt_3ps9ESUg,NARRADOR É DEMITIDO DA TV GLOBO E DESABAFA NAS REDES SOCIAIS! POLÊMICA NA EMISSORA!,2021-11-19 14:00:17+00:00,UCTeuEMYybdsJXTR7dOiGLYg,Pilhado,2021-11-25 00:00:00+00:00,345939,42943,783,3080,Narrador famoso da Rede Globo foi demitido e desabafou nas redes sociais! Veja quem é o narrador que trabalhava há muitos anos na TV Globo e entenda as polêmicas demissões do esporte da emissora! INSTABET - https://bit.ly/PILHADO100http://pilhado.com.br/⚡SEJA MEMBRO DO CANAL: https://www.youtube.com/channel/UCTeuEMYybdsJXTR7dOiGLYg/joinMe segue:Instagram THIAGO ASMAR: https://www.instagram.com/thiago_asmarInstagram PILHADO https://www.instagram.com/canalpilhadoTwitter: https://twitter.com/opilhadoFacebook: https://www.facebook.com/pilhado/CONTATO: pilhado@pilhado.com,Sports
tV7BRjFzKH8,The Matrix Awakens: An Unreal Engine 5 Experience | Teaser,2021-12-06 14:55:15+00:00,UCBobmJyzsJ6Ll7UbfhI4iwQ,Unreal Engine,2021-12-10 00:00:00+00:00,658700,6298,386,906,"Watch the teaser for 'The Matrix Awakens: An Unreal Engine 5 Experience' here! Get ready for a glimpse into the future of interactive storytelling and entertainment with UE5.Created by members of the original movie team including Lana Wachowski along with Epic Games and partners, 'The Matrix Awakens: An Unreal Engine 5 Experience' is a wild ride into the reality-bending universe of 'The Matrix' that features performances by Keanu Reeves and Carrie-Anne Moss.Pre-download 'The Matrix Awakens: An Unreal Engine 5 Experience' for free now:  https://www.unrealengine.com/wakeupStay tuned for The Game Awards on December 9, when all will be revealed! Find out more here:https://thegameawards.com/#UnrealEngine #UE5 #TheMatrix #KeanuReeves, #CarrieAnneMoss, #EpicGames, #Neo, #Trinity, #Metaverse #LanaWachowski #Teaser #Xbox #PlayStation #PS5",Gaming
xtcVwuauVV0,ATEEZ(에이티즈) - ‘불놀이야 (I'm The One)’ Official MV,2021-03-01 09:00:00+00:00,UCQdq-lqPEq_yZ_wP_kuVB9Q,KQ ENTERTAINMENT,2021-03-09 00:00:00+00:00,16576974,805735,18726,183276,Melon ▶ https://kko.to/aj3brJeDogenie ▶ https://bit.ly/3uKpfdsiTunes ▶ https://apple.co/3kwDY6ZSpotify ▶ https://spoti.fi/3r3D4kIRelease Date: 2021. 3. 1. 6PM (KST)▶ ATEEZ Official Homepage:http://ateez.kqent.com▶ ATEEZ Official V LIVE: http://channels.vlive.tv/C057DB▶ ATEEZ Official Facebook:https://facebook.com/ATEEZofficial▶ ATEEZ Official Twitter:https://twitter.com/ATEEZofficial▶ ATEEZ Official Instagram:https://instagram.com/ATEEZ_official_▶ ATEEZ Official Fancafe:http://cafe.daum.net/ATEEZ▶ KQ Official Homepage: http://kqent.com▶ KQ Official V LIVE: http://channels.vlive.tv/CB8675▶ KQ Official Facebook: https://facebook.com/kqent▶ KQ Official Twitter: https://twitter.com/kqent▶ KQ Official Instagram:https://instagram.com/kqent#ATEEZ #에이티즈 #FEVER_Part_2,Music
4-N7YA-NZa0,MEU SOBRINHO NASCEU,2022-01-09 21:00:02+00:00,UCCThgVSLCXWB_1telsNuvVA,Victor Melo,2022-01-15 00:00:00+00:00,567806,52673,0,1892,"Seja membro deste canal e ganhe benefícios:➤ Melhores Vídeos Victor Melo 4: https://youtu.be/5YGoJhvXyTw➤ Melhores Vídeos Victor Melo 5: https://youtu.be/mp8SB4f9G2o➤ Melhores Vídeos Victor Melo 6: https://youtu.be/YyhUwUWDbYEInscrevam-se, deixe seu Like nesse vídeo e compartilhem!Me acompanhe nas redes sociais:➤ https://bit.ly/VictorMeloNoInstagram➤ https://bit.ly/VictorMeloNoTikTok➤ https://bit.ly/VictorMeloNoTwitter➤ http://bit.ly/AsMelhoresDoVictor➤ http://victormelo.com.br/ASJ Consultoria:➤ http://bit.ly/InstagramASJ➤ http://bit.ly/TwitterASJ➤ http://bit.ly/ASJTV-INSCREVA-SE#victormelo #humor #escola",Comedy
ZJq1AVNu6HU,Bayern winning Supercup! | FC Bayern München - Borussia Dortmund | 3:2 | Highlights | Supercup 2020,2020-09-30 22:00:07+00:00,UC6UL29enLNe4mqwTfAyeNuw,Bundesliga,2020-10-06 00:00:00+00:00,2122940,34243,1174,1393,"#FCBBVB | Highlights from Supercup 2020!► Sub now: https://redirect.bundesliga.com/_bwCS Watch the highlights of FC Bayern München vs. Borussia Dortmund from the Supercup 2020!Goals: 1-0 Tolisso (18’), 2-0 Müller (32’ ), 2-1 Brandt (39’), 2-2 Haaland (55’), 3-2 Kimmich (82’)► Watch Bundesliga in your country: https://redirect.bundesliga.com/_bwCT► Join the conversation in the Bundesliga Community Tab:https://www.youtube.com/bundesliga/communityWe’ve seen another Matchday full of unmissable Bundesliga drama. Don’t miss any highlights from Germany’s football league! The Official Bundesliga YouTube channel gives you access to videos about the greatest goals, best moments and anything else you should know about. Make sure to subscribe now and visit us at https://bndsl.ga/comYT to find out more about the fixtures, analysis and news about your favourite team!",Sports
RAmMdGmzdUs,A Cor que Falar eu vou Pintar,2021-12-06 18:00:06+00:00,UCNWNigsfBZoNNyycCGd3k1g,Jeipy,2021-12-12 00:00:00+00:00,1763970,193414,2091,934,🙃Mais um Video🙃----------------------------------------------------------------Siga minhas Redes ou um Hamster Fofinho vai morrer ⬇️⬇️⬇️• Tik Tok- https://www.tiktok.com/@j3ipy_• Twitter - https://twitter.com/j3ipy•  Instagram - https://www.instagram.com/jpnardes/--------------------------------------------------------------------#Shorts #ShortsNoBrasil,Entertainment
3HWnXYA3Pb0,JBEATZ - OU PAT MERITE'M (I'm Still Doing Fine) Feat. YungRich [OFFICIAL VIDEO],2022-07-02 21:00:09+00:00,UCJLIG5RKlQYPIVK8Zc1iEPg,JBEATZ DABEATZ,2022-07-10 00:00:00+00:00,1122468,45335,0,8502,"Starring: FEDNAELLE FRANÇOIS, BETTY LEMITE, BETTYONCE, JOSUE CHARLES Storyline Produced by Jbeatz Direct and edited by KnVisuals, Fedna Wardrobe by Cassie, Make up by _ItsmariachicExtras: Baby1King, Fredly Jean Baptiste, Belandie Cherestal, Maria Elda wilson",Music
